{
  "schema_version": 1,
  "max_attempts": 3,
  "initial_backoff_ms": 500,
  "max_backoff_ms": 8000,
  "jitter": 0.2,
  "retryable_codes": [
    "provider_rate_limited",
    "provider_overloaded",
    "provider_timeout",
    "provider_connection_reset",
    "provider_internal_error",
    "provider_stream_disconnected"
  ]
}
